objective-value	target-start	target-end	target-length	left-primer-start	left-primer-num-primers	left-primer-frac-bound	left-primer-target-sequences	right-primer-start	right-primer-num-primers	right-primer-frac-bound	right-primer-target-sequences	num-guides	total-frac-bound-by-guides	guide-set-expected-activity	guide-set-median-activity	guide-set-5th-pctile-activity	guide-expected-activities	guide-target-sequences	guide-target-sequence-positions
4.088555704017946	486	595	109	486	1	0.9558823529411765	CTTGGTTGTGAGTCCTCCGGCCCCTGAATG	565	1	0.8970588235294118	GTCGTAATGAGCAATTCCGGGACGGGACCG	1	0.9117647058823529	2.492233165046748	2.7243345975875854	0.0	2.492233165046748	CGGCTAACCTTAACCCCGGAGCCTTGTG	{516}
2.3090099051195434	674	850	176	674	2	0.8970588235294118	TGTGATCATGGGCGCTCAGGTTTCAACACA TGTGATCATGGGTGCACAAGTGTCAACACA	820	3	0.8823529411764706	CAATGGACCCAAGCAAATTTACTGAACCAG CAATGGATCCATCAAAATTTACTGAACCAG CAATGGATCCTTCCAAGTTTACTGAACCTG	2	0.9852941176470589	2.7735051539014366	2.8880163431167603	1.8002912998199463	1.730958755402004 2.4602624695090687	AATGGATCAAATCAAACTTTCACAGTCA ACTATTACAAGGATGCAGCCAGCTCATC	{741} {772}
1.288243594309976	4783	4918	135	4783	2	0.8970588235294118	ACCAGACCCAAAACATTTTGATGGATATCA ACCAGATCCAAAACACTTTGATGGTTACCA	4888	4	0.8676470588235294	GGTATCATCAGTTGACTTTCTGCCTCCAAT GGTGTCTTCAGTTGATTTTATTCCACCTAT GGTTTCATCAGTTGATTTCATACCACCAAT GGTTTCTTCAGTAGATTTCTTACCACCAAT	3	0.9411764705882353	2.3454482669339463	2.432917356491089	0.0	1.644795282798655 1.4924623878563152 1.0721376704819061	AGATGGTCAAGATATCAGTATGTTTTGT CGGATGGACAAGACATCAGCATGTTTTG CTAATGGTGAAGATATTAGTACATTCTG	{4855} {4854} {4854}
1.0045990407918612	896	1142	246	896	4	0.8676470588235294	CATAGAAGCATGTGGTTACAGTGACAGAGT CGTTGAAGCGTGTGGGTATAGTGACAGGGT TGTCGAGGCATGTGGATACAGTGATAGGGT TGTTGAAGCATGTGGTTATAGTGATAGAGT	1112	3	0.8676470588235294	AAAAGGATGGTGTTGGAAACTACCAGATGC AAAAGGATGGTGTTGGAAGTTTCCAGATGC TAAAGGCTGGTGTTGGAAACTGCCTGATGC	2	1.0	2.639388743568869	2.5708067417144775	2.017987608909607	2.250390539274496 2.2643335856059017	TAAAGATGCAAGTGATGTAAACAAAACT TTCTGATGCAAGTGATGTGAATAAAACC	{1019} {1019}
0.7763144047178177	4227	4350	123	4227	6	0.8529411764705882	AGGATGTGATGGTTCTCCCTGGAGGTTCCT AGGGTGTGATGGCTCACCCTGGAGATTCCT GGGGTGTGATGGATCACCATGGAGGTTTTT GGGTTGTGATGGTTCCCCTTGGAGATTTTT TGGATGTGACGGGTCGCCTTGGAGATTTCT TGGTTGTGACGGATCTCCATGGAGGTACCT	4320	2	0.8676470588235294	GTTCAGAAAATTCAATGATGCTTGCAATGC GTTTAAGAAGTTCAATGACATGTGCAATGC	2	1.0	2.520634385592797	2.6063040494918823	1.734522819519043	1.6385650082546122 2.0274738231126	TACCTTACATAGAAAGACAGTCCAATGA TCAGGTACCATATATTGAAAGACAAGCA	{4286} {4281}
0.15469496890459844	2905	3103	198	2905	2	0.8529411764705882	AATGGAATGATTATACATGGCAAAGTGCCT AATGGGATGATTACACATGGCAAAGTGCTT	3073	7	0.8529411764705882	TAAACCACATGGGCTCAATAGCTTTTAGAG TAAATCACATGGGCTCTATAGCATTCAGAG TAAATCACATGGGTAGCATGGCCTTCAGAA TAAATCACATGGGTAGTATGGCATTTAGAG TCAATCATATGGGTAGCATAGCCTTTAGAG TGAACCACATGGGTAGCATTGCTTTCAGAG TGAATCATATGGGTAGCATGGCTTTTAGAA	2	0.9705882352941176	2.681826083099141	2.7207136154174805	1.9504072666168213	2.330239251255989 2.3940903658376023	AATTGTTTCTATGATGGTTACTCACATG ACTGTTTTTATGATGGCTATTCACATGA	{3012} {3013}
-0.3622494402386245	6792	7041	249	6792	5	0.8529411764705882	CAGTGGGATGTGATCCAGATGTGTTTTGGT CAGTGGGGTGTGATCCAGACACTTTTTGGT CAGTTGGGTGTGATCCAGATGTCTTCTGGT CTGTGGGATGTGATCCAGATACTTTCTGGT CTGTGGGCTGTGATCCCGATGTTTTCTGGT	7011	5	0.8529411764705882	AAGGAGGAATGCCATCAGGGTGTTCAGGAA AAGGAGGAATGCCATCAGGTTGTTCTGGAA AAGGTGGAATGCCATCTGGTTGCTCTGGAA AGGGAGGAATGCCATCTGGGTGCTCTGGCA AGGGAGGTATGCCATCAGGTTGTTCAGGCA	2	1.0	2.7783111658166435	2.8826688528060913	1.9277617931365967	2.516745753148023 2.406457493410391	TTTGATTATTCAAATTTTGATGCCTCCC TTTTGATTATTCAAATTTTGATGCTAGT	{6860} {6859}
-0.7491973029790984	3872	3986	114	3872	5	0.8676470588235294	GAGTGGGACCAGCTGAACCAGGGGATTGTG GAGTTGGACCAGCAGAACCAGGAGACTGTG GTGTCGGACCTGCTGAGCCAGGTGATTGTG GTGTTGGACCAGCTGAACCAGGAGATTGTG GTGTTGGTCCCGCAGAACCAGGTGATTGTG	3956	5	0.8823529411764706	GTGGATATGTTTGTTTTGCTGACATCAGAG GTGGGTTTGTGTGCTTTGCAGACATTAGAA GTGGTTATGTCTGCTTTGCAGATATCAGAC GTGGTTATGTCTGTTTTGCTGACATTAGAG GTGGTTATGTTTGTTTTGCAGACATCAGAC	2	0.9705882352941176	1.939524572561769	1.9613542556762695	1.3098258972167969	1.5271221285357195 1.0078794360160828	CTGAGATGTGTGCATGGTCCAATTGGGC TAGATGTATACATGGACCGATTGGACTG	{3910} {3912}
-1.2174428118771656	2033	2152	119	2033	5	0.8823529411764706	GTACACAGGTCCAGCTTTATCCAGTGCAAA GTACACTGGCCCAGCACTATCTAGTGCTAA GTACACTGGTCCAGCTTTGTCTAGTGCAAA GTATACAGGTCCCGCCTTGTCCAGTGCAAA GTATACAGGTCCTGCATTATCAAGTGCTAA	2122	5	0.8529411764705882	TGCTTGGAACACATGTTGTGTGGGATATTG TGCTTGGTACTCACGTAGTCTGGGATATTG TGTTAGGTACACATGTAGTTTGGGATATTG TGTTGGGCACACATGTGGTGTGGGATGTTG TGTTGGGTACTCATGTAATCTGGGATATTG	2	0.7205882352941176	1.503217950463295	1.5610530376434326	0.0	1.0180799198501251 1.1668498638798208	ACCTTAGCTTACACACCACCTGGAGCCC TTACTTGCATATACACCACCAGGAGCAC	{2067} {2067}
-1.3118262897067776	1505	1751	246	1505	5	0.8970588235294118	AGTACCAATGGATTCAATGACAAGACACAA AGTACCAATGGATTCAATGACACGTCATAA AGTACCAATTGACTCAATGACACGACATAA AGTACCCATGGATTCCATGACTAGACATAA AGTGCCCATTGACTCAATGACCAGACACAA	1721	5	0.8676470588235294	ATTTCTAACCACAGATGATAGACAATCACC ATTTCTGACTACTGATGATAGACAATCACC GTTTCTAACCACTGATGATAGGCAATCACC GTTTTTAACCACAGATGATAGGCAATCACC GTTTTTGACCACTGATGACAGACAATCACC	2	0.8823529411764706	1.82296341307023	1.965914249420166	0.0	1.3551109310458689 1.0456121423665214	CAATACCAGTAACAGTGACCATTGCACC TTGCACCAATGTGCACAGAGTTCTCTGG	{1597} {1618}
-1.393158218295837	7332	7437	105	7332	6	0.8529411764705882	CAGTAATGCCAATGCAAGATATACACGAAT CAGTAATGCCAATGCAGGATATCTATGAGT CAGTAATGCCAATGGCTGATATACATGAAT CAGTGATGCCAATGCAAGACATTCATGAAT CAGTGATGCCTATGAAGGATATTCACGAAT CAGTTATGCCAATGTCAGACATACATGAAT	7407	5	0.8823529411764706	GATCACTATGCATGCTAGCCTGGCATTCAG GATCATTGTGTATGATGGCATGGCATTCAG GATCTCTGTGTATGTTAGCATGGCATTCAG GATCTTTATGCATGTTAGCTTGGCATTCTG GGTCATTATGTATGTTAGCATGGCACTCAG	2	0.8676470588235294	1.7298050557865816	1.8372931480407715	0.0	1.3960804150385016 1.3060916153823627	AGGGATCCAAGGAATACTCAAGATCATG CGTGATCCTAGGAACACCCAAGACCATG	{7376} {7376}
-1.4682197524399045	2206	2456	250	2206	7	0.8676470588235294	GATACACAGACCCAGACACATACACCAGTG GATACACAGACCCTGATACTTATACTAGTG GATACACGGACAAAGACACATACACTAGTG GATACACTGACCCAGATACATACACACATC GATATACAGACCCAGACACCTACACACACC GATATACAGATCCAGACACATACACTAGTG GGTACACAGATCCAGATACTTACACCAGTG	2426	5	0.8529411764705882	AGTCGACAAAGCGAAACAGACTATTGCTTC AGTTGAAAAAACAAAACAGACAGTGGCCTC TATCGACAAAATGAAACAGGTAACAGCTTC TGTCGAGAAAACGAAACAGACATTGGCTTC TGTTGACAAAACGCAGCAAACACTGGCTTC	2	0.9705882352941176	2.674244149642832	2.774116277694702	1.798973560333252	2.014981120824814 2.255308366873685	CCTGTTGGTATCAAACATCACTCATACT TCATTAGTGCATGTCCAGATTTCAAACT	{2248} {2317}
-1.73526106130877	1153	1247	94	1153	6	0.8970588235294118	TGGGAGTATTTGGACAAAACATGTTTTTCC TGGGAGTGTTTGGACAAAACATGTTCTTTC TGGGCGTATTTGGACAAAACATGTTCTTCC TGGGCGTATTTGGACAGAATATGTTCTACC TGGGCGTATTTGGTCAAAACATGTTTTTTC TGGGGGTATTTGGACAGAACATGTTTTACC	1217	5	0.8529411764705882	ACAGTGTAATGCAACAAAATTCCACAGTGG GCAATGCAATGCAACCAAATTTCATAGTGG GCAATGTAACGCCACCAAATTCCACAGTGG TCAATGCAATGCTACAAAATTCCACAGCGG TCAGTGTAATGCCACTAAATTCCACAGTGG	1	0.5147058823529411	1.0366046490038143	1.1785657405853271	0.0	1.0366046490038143	TTGGTAGAACAGGATATACTATCCATGT	{1189}
-2.331822227411788	6030	6129	99	6030	8	0.8529411764705882	ACGACTACCCAACAAAAACAGGGCAGTGTG ACGAGTACCCAACAAAAACAGGACAATGTG ACGATTATCCCACCAAAACGGGCCAGTGTG ATGAGTACCCTACTAGAACAGGACAATGTG ATGAGTATGCAACAAAAACAGGTCAGTGTG ATGATTACCCAACAAAGACTGGTCAGTGTG ATGATTATCCAACCAAAACAGGACAATGTG ATGATTTCCCCACCAAGACAGGACAGTGTG	6099	6	0.8529411764705882	ACGTTGGTGGTAATGGTAGACAGGGATTTT ATGTGGGTGGAAATGGAAGACAGGGTTTTT ATGTTGGAGGCAATGGTAGGCAAGGCTTTT ATGTTGGTGGCAATGGAAGACAAGGTTTCT ATGTTGGTGGCAATGGAAGGCAAGGTTTCT ATGTTGGTGGTAATGGAAGACAAGGCTTTT	2	0.9117647058823529	2.2395283273037743	2.3617221117019653	0.0	1.4752263198880589 1.44572135543122	TACTGTGCACAACTGGTAAAATCTTTGG TTTTATGCTCAACAGGCAAAATTTATGG	{6066} {6066}
-4.104709620630672	5014	5175	161	5014	8	0.8676470588235294	AGAAGCACTAACTAGACGGTTTGGATTTGA AGAAGCACTAGCCAGAAGATTTGGATTTGA AGAAGCATTAGCACGTAGATTTGGATTTGA AGAAGCATTGGCAAGGAGATTTGGGTTTGA AGAAGCCCTGGCTAGGAGATTTGGTTTTGA AGAAGCTTTAGCACGTAGATTTGGTTTTGA AGAGGCATTGGCACGTAGATTTGGGTTTGA CGAAGCGTTAGTCAGGAGATTTGGTTTTGA	5145	9	0.8529411764705882	AAAAGTGCTGCCCACTGGTTTGTGGCAAAG AAAAGTGCTGTCCACTTATTTGTGGAAAAG AAAAGTGCTGTCCGTTAATTTGCGGAAAAG AAAAGTGTTGCCCGTTAGTCTGTGGCAAAG ACAGGTGTTGCCCATTGATATGTGGCAAAG AGAAATGCTGTCCATTAGTTTGTGGTAAAG AGAAATGTTGCCCATTAGTTTGTGGAAAAG AGAGATGCTGCCCTCTGATTTGTGGCAAAG ATAAGTGTTGTCCACTAATATGTGGCAAAG	2	0.9558823529411765	2.3098432500572765	2.3419463634490967	1.255300760269165	1.1501881375032312 1.582084332318867	AGCTTTGCAAGGACTGCCACAAACCCAG TCTGTGCAAAGATTGTCATCAACCAGCC	{5109} {5110}
