cost	target-start	target-end	target-length	left-primer-start	left-primer-num-primers	left-primer-frac-bound	left-primer-target-sequences	right-primer-start	right-primer-num-primers	right-primer-frac-bound	right-primer-target-sequences	num-guides	total-frac-bound-by-guides	guide-target-sequences	guide-target-sequence-positions
3.2903942636811996	487	603	116	487	1	0.9558823529411765	TTGGTTGTGAGTCCTCCGGCCCCTGAATGC	573	1	0.9117647058823529	GAGTAATTCTGGGATGGGACCGACTACTTT	6	0.8970588235294118	CAACATAATCCAATGTTGTTTGGGTCGT CTAACCTTAACCCCGGAGCCTTGCATCA GGCTAACCCTAACCCCGGAGCCTTGCAC GGCTAACCCTAACCCCGGAGCCTTGTGG GGCTAACCTAAACCCCGGAGCCTTGAGA GGCTAACCTTAAACCCGGATCCATGCTA	{542} {519} {517} {517} {517} {517}
4.806526686365172	447	542	95	447	4	0.9117647058823529	GACGCCAATTCATTGACATGGTGTGAAGAC GACGCCTACTAATAGACATGGTGTGAAGAT GACGCCTTAAGTATGACATGGTGTGAAGAC GACGCCTTTTTATAGACATGGTGTGAAGAC	512	1	0.9264705882352942	AATGCGGCTAACCTTAACCCCGGAGCCTTG	3	0.9558823529411765	CTATTGCGCTTAGCTGTGAGTCCTCCGG TGCTTAATTGTGAGTCCTCCGGCCCCTG TGCTTGGTTGTGAGTCCTCCGGCCCCTG	{478} {484} {484}
4.849232422683972	484	704	220	484	1	0.9411764705882353	TGCTTGGTTGTGAGTCCTCCGGCCCCTGAA	674	3	0.9264705882352942	TGTAATCATGGGTGCACAGGTGTCTACACA TGTGATCATGGGCGCACAAGTTTCTACTCA TGTGATCATGGGCGCTCAAGTGTCAACACA	5	0.8970588235294118	GCGGCTAACCTTAAACCCGGATCCATGC GCTAACCTTAACCCCGGAGCCTTGCAGC GGCTAACCCTAACCCCGGAGCCTTGCAT GGCTAACCTAAACCCCGGAGCCTTGAGA GTTTGGGTCGTAATGAGTAATTCCGGGA	{515} {518} {517} {517} {559}
5.166189493487165	390	526	136	390	4	0.9117647058823529	ACTCCCCACGGGTAACCGTGTCTCAGCCTG ATTCCCCACGGGTGACCGTGTCCTAGCCTG GTACCCCACAGGTAACTGTGTTCTAGCCTG GTCCCCCACAGGTAACTGTGTCTCAGCCTG	496	1	0.9558823529411765	AGTCCTCCGGCCCCTGAATGCGGCTAACCT	4	0.9117647058823529	CATGGTGTGAAGACCCGCATGTGCTTGA CCCAGCTTATGCTGGGACGCCTTAATTG CGTGGCGGCCAACCCAGCAATTGCTGGG TGTGAAGATCCTATTGCGCTTAGCTGTG	{463} {432} {420} {468}
5.257723411032159	390	593	203	390	4	0.9117647058823529	ACTCCCCACGGGTAACCGTGTCTCAGCCTG ATTCCCCACGGGTGACCGTGTCCTAGCCTG GTACCCCACAGGTAACTGTGTTCTAGCCTG GTCCCCCACAGGTAACTGTGTCTCAGCCTG	563	1	0.9264705882352942	AGGTCGTAATGAGCAATTCTGGGATGGGAC	3	0.9558823529411765	CATGGTGTGAAGACCCGCATGTGCTTGA GGCTAACCTTAACCCCGGAGCCTTGTGG TGCTTAATTGTGAGTCCTCCGGCCCCTG	{463} {517} {484}
6.619016373031192	518	617	99	518	6	0.9117647058823529	GCTAACCCTAACCCCGGAGCCCAGCGACAT GCTAACCCTAACCCTGGAGCCTTGCACCAC GCTAACCTAAACCCTGGAGCCTTGAAACAC GCTAACCTTAACCCCGGAGCCTTGCAGCAT GCTAACCTTAACCCCGGAGCCTTGTGGTGC GCTAACCTTAACCCTGGAGCCTTGTGTCAC	587	1	0.9558823529411765	TGGGACCGACTACTTTGGGTGTCCGTGTTT	7	0.8823529411764706	ACCAATGTTGTGGAGGTCGTAATGAGCA AGCAAGGTCGTAACGAGCAATTCCGGGA CAGTAACATTAAGGTCGTAATGAGCAAT CCAGTGCTTACAAGGTCGTAATGAGCAA GGCAAGGTCGTAATGAGCAATTCTGGGA GTATGGGTCGTAATGAGTAATTCTGGGA TCCAATGTTGTTTGGGTCGTAATGAGTA	{550} {559} {552} {551} {559} {559} {550}
7.116070128054923	514	704	190	514	4	0.9264705882352942	TGCGGCTAACCCTAACCCCGGAGCCAAGCA TGCGGCTAACCTAAACCCTGGAGCCTTGAA TGCGGCTAACCTTAAACCCGGATCCATGCT TGCGGCTAACCTTAACCCCGGAGCCTTGTG	674	3	0.9264705882352942	TGTAATCATGGGTGCACAGGTGTCTACACA TGTGATCATGGGCGCACAAGTTTCTACTCA TGTGATCATGGGCGCTCAAGTGTCAACACA	8	0.9117647058823529	ACCAATGTTGTGGAGGTCGTAATGAGCA AGCAAGGTCGTAACGAGCAATTCCGGGA AGGTCGTAATGGGCAACTCTGGGACGGG CAGTAACATTAAGGTCGTAATGAGCAAT GGCAAGGTCGTAATGAGCAATTCTGGGA GTATGGGTCGTAATGAGTAATTCTGGGA TCCAATGTTGTAGAGGTCGTAACGAGTA TCCAATGTTGTTTGGGTCGTAATGAGTA	{550} {559} {563} {552} {559} {559} {550} {550}
7.550207968360734	576	814	238	576	1	0.9264705882352942	TAATTCTGGGATGGGACCGACTACTTTGGG	784	7	0.9117647058823529	ATGCAGCAAGCTCATCATCTGCCGGCCAGT ATGCAGCAAGTTCATCATCAGCTGGTCAAT ATGCAGCCAGCTCATCATCAGCCGGGCAGT ATGCAGCCAGTTCGTCATCGGCTGGTCAAT ATGCAGCTAGTTCATCATCTGCAGGACAAT ATGCAGCTAGTTCTTCCTCTGCTGGCCAAT ATGCTGCAAGTAGCTCATCAGCTGGTCAAT	5	0.9705882352941176	AAAAAGCGGCTCACATGAAAATCAAAAC ATCAAACTTTCACAGTCATAAACTACTA GAAAATCAAAACATTCTTACAAATGGAT GCACAAGTGTCTACACAGAAGAGTGGCT TCAAGTTTCAACACAGAAGAGTGGATCT	{704} {751} {720} {687} {689}
8.553789758004454	4344	4584	240	4344	5	0.9117647058823529	CAACGCAGCAAAAGGTTTGGAATGGATTGC CAATGCAGCAAAAGGTTTAGAATGGATAGC CAATGCAGCTAAAGGACTGGAATGGATAGC CAATGCTGCAAAGGGTCTTGAATGGATTGC TAATGCAGCAAAAGGTCTGGAATGGATTGC	4554	4	0.9411764705882353	GGCTAGAGCAGATGTCCCAGAAGTTTGCCC GGTTGGAACAAATGTCACAAAAGTTTGCCC GGTTGGAACAAATGTCTCAGAAATTTGCAC GGTTGGAGCAGATGTCACAAAAATTCTCAC	8	0.9411764705882353	AAACTAATTGAATGGGTCAAAAACAAGG AACAAAAATAATCCCCCAGGCAAAGGAG ATAGAATGGATCAAAAACAAAGTTCTAC ATAGAGTGGATTAAAAATAAAATATTAC CTGGATTTCTGCAAAAGACTCAAACAGC CTTCTGCAAAAGACTCAAACAATTAGAC GAATGGGTCAAACAGAAAATTTTACCAC GACATTCTAGAAAGACAAATAACCACAA	{4387} {4407} {4393} {4393} {4438} {4443} {4396} {4468}
8.895972960526725	674	919	245	674	3	0.9264705882352942	TGTAATCATGGGTGCACAGGTGTCTACACA TGTGATCATGGGCGCACAAGTTTCTACTCA TGTGATCATGGGCGCTCAAGTGTCAACACA	889	7	0.9264705882352942	CACCAAATATAGAGGCGTGTGGATACAGTG CACCAAATGTTGAAGCATGTGGTTATAGTG CACCCAACGTTGAAGCGTGTGGATATAGTG CACCCAATATAGAAGCGTGTGGATATAGTG CCCCAAATGTTGAAGCATGTGGGTATAGTG CCCCTAATGTTGAAGCATGTGGATACAGTG CTCCCAACGTTGAAGCATGTGGATACAGTG	5	0.9558823529411765	AAAGAGTGGTTCACACGAAAACCAAAAC AAGAGTGGCTCACATGAAAATCAAAACA ATCAAACTTTCACAGTCATAAACTACTA CAATCTTTTTCAATGGATCCATCAAAAT GGCTCACATGAAAATCAAAACATTCTTA	{704} {705} {751} {810} {711}
8.939643925003942	820	933	113	820	4	0.9411764705882353	CAATGGACCCAAGCAAATTTACTGAACCAG CAATGGACCCATCTAAGTTCACAGAGCCAG CAATGGATCCATCAAAATTTACTGAACCAG CAATGGATCCTTCCAAGTTTACTGAACCTG	903	6	0.9117647058823529	GCATGTGGCTATAGTGATAGAGTAGAACAA GCATGTGGTTACAGTGATAGGGTTCAACAA GCATGTGGTTATAGTGATAGAGTGCAACAA GCGTGTGGGTATAGTGACAGGGTGCAACAA GCGTGTGGTTACAGTGACAGAGTTGAACAA GCTTGTGGATACAGTGATAGGGTGGAACAA	9	0.8823529411764706	AATGCTCAAGGGTGCACCAGCTCTAAAT AGACATCATGTTAAAGGGTGCACCTGCA ATCATGCTGAAAGGAGCACCAGCTTTGA ATGCTGAAAGGCGCCCCAGCGTTAAACT ATGCTTAAAGGAGCACCAGCACTAAATT CACCAGCACTAAATTCACCCAACGTTGA CACCAGCTTTGAACTCACCCAACATAGA TCAAAGATATTATGCTAAAAGGAGCACC TGTTAAAAGGAGCCCCAGCACTAAACTC	{860} {854} {858} {861} {861} {874} {874} {850} {862}
9.162043513028186	1112	1247	135	1112	4	0.9117647058823529	AAAAGGCTGGTGTTGGAAACTACCAGATGC AAAGGGATGGTGCTGGAAACTACCAGATGC CAAAGGCTGGTGTTGGAAATTGCCCGATGC TAAAGGATGGTGTTGGAAGCTGCCTGATGC	1217	6	0.9117647058823529	ACAATGTAATGCTACAAAATTCCACAGCGG ACAGTGTAATGCCACAAAATTTCACAGTGG GCAATGTAACGCCACAAAGTTTCACAGTGG GCAATGTAATGCAACCAAATTCCACAGTGG TCAGTGCAATGCAACTAAATTCCATAGTGG TCAGTGCAATGCTACTAAATTTCACAGTGG	10	0.8676470588235294	AACATGTTCTTTCACTCACTTGGTAGAT AACATGTTTTTCCACTCACAAGGCAGAA GACAAAACATGTTCTATCACTCACAAGG GGGAGTATTTGGACAGAACATGTTTTTC GGTGTATTTGGACAAAATATGTTTTTCC GTCAGAACATGTTTTACCATTCACTTGG GTTTTTGGCCAAAACATGTTTTTCCACA TCATTCTCAAGGCAGAACTGGGTACACC TGGGAGTGTTTGGACAAAACATGTTTTT TGGGTGTGTTCGGGCAAAACATGTTTTT	{1170} {1170} {1165} {1154} {1155} {1165} {1158} {1181} {1153} {1153}
9.220489758004453	902	1142	240	902	6	0.9117647058823529	AGCATGTGGTTACAGTGATAGAGTTCAACA AGCATGTGGTTATAGTGATAGAGTCCAGCA AGCGTGTGGGTATAGTGACAGGGTGCAACA AGCTTGTGGTTATAGTGATAGAGTGGAGCA GGCATGTGGATATAGTGACAGAGTACAACA GGCGTGTGGATACAGTGATAGGGTACAACA	1112	4	0.9117647058823529	AAAAGGCTGGTGTTGGAAACTACCAGATGC AAAGGGATGGTGCTGGAAACTACCAGATGC CAAAGGCTGGTGTTGGAAATTGCCCGATGC TAAAGGATGGTGTTGGAAGCTGCCTGATGC	8	0.9264705882352942	AAACCTCAAAACCTGACACATCAGTATG ATAACCATAGGAAATTCAACCATCACAA ATTACACTTGGAAATTCAACAATCACAA CAATTGTAGCATACGGGGAGTGGCCATC GCTAGTGATGTAAACAAAACTTCAAAAC GTGATGTTAATAAAACTTCCAAACCAGA TGATGTGAACAAACCTACCAGACCTGAC TGCAGGTTTTACACACTGGATAGCAAAA	{1042} {933} {933} {979} {1026} {1030} {1031} {1068}
9.323322420167964	4231	4353	122	4231	7	0.9117647058823529	TGCGATGGGTCACCATGGAGGTTTCTCAAA TGTGACGGGTCGCCTTGGAGATTTCTCAAG TGTGATGGATCACCCTGGAGATTTCTCAAA TGTGATGGCTCACCTTGGAGATTCCTAAAA TGTGATGGGTCACCATGGAGGTATTTAAAA TGTGATGGTTCCCCTTGGAGATTTTTAAAA TGTGATGGTTCTCCATGGAGGTTCCTCAAA	4323	4	0.9264705882352942	CAAAAAGTTTAATGACATGTGCAATGCTGC CAGAAAATTCAATGATGCTTGCAATGCAGC TAAGAAGTTCAATGACATGTGTAATGCAGC TAGAAAGTTTAATGATGCCTGCAATGCTGC	6	0.9558823529411765	ACATATCAAAACACTTCCAAGTGCCTTA ATGTACATCAGTAAGCATTTTCACCTGC GCATTTTCAAGTACCATACATTGAAAGA TACCCTACATTGAAAGACAATCAAATGA TATAGAAAGACAATCCAATGATTTATGG TCCAGGTACCATACATTGAAAGACAAGC	{4265} {4261} {4275} {4286} {4293} {4280}
9.324485705661207	700	848	148	700	7	0.9117647058823529	CACAAAAGAGTGGATCTCACGAGAATCAAA CACAAAAGAGTGGCTCACACGAAAACCAGA CACAAAAGAGTGGTTCACATGAGAATCAGA CACAGAAAAGTGGTTCCCACGAGAATCAAA CACAGAAGAGCGGTTCCCACGAAAACCAAA CACAGAAGAGTGGTTCACATGAAAATCAAA CTCAAAAAAGTGGCTCGCATGAAAATCAAA	818	4	0.9264705882352942	CTCAATGGACCCATCAAAATTCACAGAACC TTCAATGGACCCAAGCAAATTTACTGAACC TTCAATGGATCCATCAAAGTTTACTGAACC TTCAATGGATCCATCTAAGTTCACAGAGCC	5	0.9411764705882353	ACAAATGGATCACATCAAACCTTCACCG ACTAATGGATCAAATCAAACCTTCACAG TACTACAAGGATGCAGCAAGTTCATCAT TCACAGTCATAAACTACTACAAGGATGC TTATTACAAAGATGCAGCAAGTTCATCA	{738} {738} {774} {760} {773}
9.442689758004454	4665	4815	150	4665	8	0.9264705882352942	GAACCGAACCAGTTTGTGTTCTAATCCATG GAACTGAACCAGTCTGTGTTTTAATTCATG GAACTGAACCAGTGTGTGTTTTAATACACG GCACAGAACCAGTATGTGTCCTCATACACG GCACAGAACCAGTGTGTGTGCTAATACATG GGACTGAACCAGTATGTGTGTTGATTCATG GGACTGAACCTGTTTGTGTGTTAATACACG GGACTGAGCCTGTGTGTGTTTTAATCCATG	4785	2	0.9117647058823529	CAGACCCAAAACATTTTGATGGATATCAGC CAGATCCAAAACACTTTGATGGTTACCAAC	12	0.9264705882352942	AGCAGAATACTTTAACTCATCAGTCTAC AGGACGTGCACTAGCCGAACACCTCAAC ATACATAAATCTTCAGTTTATTCCCTCC CAGAGCCATAGCAGAAAGATACAAATCA CCTGGATCAGGAAAATCACTAACCACAT CCTGGCTCAGGTAAATCATTAACAACCT GAACACTTCAATTCAGCAGTATATTCAC GCAAATCATTAACCACTTCATTAATTGG GCAGCCCTGGCTCCGGGAAATCTCTAGC GTACACCAGGTTCTGGCAAATCACTAAC GTACACCGGGGTCTGGAAAATCCCTTAC TAGCAGAACAATTTAACTCAGCAGTCTA	{4747} {4735} {4754} {4738} {4700} {4700} {4751} {4710} {4695} {4695} {4695} {4746}
9.671770128054922	2918	3108	190	2918	3	0.9264705882352942	CACATGGCAAAGTGCTTCAAACCCCAGTGT TACATGGCAGAGTGCAACTAATCCCAGTGT TACATGGCAGAGTGCCTCAAATCCTAGTGT	3078	8	0.9264705882352942	CACATGGGAAGCATTGCCTTCAGAGTGGTG CACATGGGCTCAATGGCTTTTAGAGTAGTT CACATGGGCTCTATAGCATTCAGAGTAGTT CACATGGGTAGTATGGCTTTCAGAGTGGTT CACATGGGTAGTATTGCTTTCAGGGTAGTC CATATGGGTAGCATGGCTTTTAGAATAGTT CATATGGGTAGTATAGCATTTAGGATAGTC CATATGGGTAGTATGGCATTTAGAGTAGTC	7	0.8823529411764706	AATGTAGGAAAATCTGCCAGATTTAGTG ACGATGGTTACTCACATGATAACGAAAA ATTGTTTCTATGATGGTTACTCACATGA CAATTTCTATGATGGCTACTCACATGAC CAGCATATAATTGCTTCTATGATGGTTA CAGCTAGATTTAGCGTGCCATACTTAGG GAAGTTGGCAAAACAGCTAGGTTCAGTG	{2955} {3022} {3013} {3014} {3004} {2968} {2955}
9.793421916171136	4786	4941	155	4786	2	0.9117647058823529	AGATCCAAAACACTTTGATGGTTACCAACA AGATCCCAAACATTTTGATGGTTATCAGCA	4911	9	0.9117647058823529	CACCAATGGCAAACTTAGATAATAAAGGCA CACCAATGGCAAATTTGGACAACAAAGGGA CACCAATGGCTAGCTTAGATAACAAAGGTA CACCCATGGCCAGCTTAGATAACAAAGGGA CACCCATGGCTAGTTTAGACAATAAAGGAA CACCGATGGCCAGCTTGGACAATAAAGGCA CCCCAATGGCAAACCTAGATAACAAAGGTA CTCCAATGGCCAATCTAGACAATAAAGGAA CTCCAATGGCTAGTTTAGATAACAAGGGAA	9	0.9117647058823529	AATCCAAATGGTGAAGATATTAGTACCT AGCACTTTTTGTCAAATGGTGTCTTCAG AGTACTTTCTGTCAAATGGTGTCATCAG AGTATGTTCTGCCAGATGGTCTCATCAG AGTATGTTTTGTCAAATGGTCTCATCAG ATCAGCATGTTTTGTCAAATGGTTTCTT CAAGCAGTCGTCATACTTGATGACCTAA CAGATGGCCAAGATATTAGTATGTTTTG CCAAATGGTATCATCAGTGGACTTTCTG	{4850} {4871} {4871} {4871} {4871} {4868} {4817} {4854} {4882}
9.902830266661923	4554	4803	249	4554	4	0.9411764705882353	GGCTAGAGCAGATGTCCCAGAAGTTTGCCC GGTTGGAACAAATGTCACAAAAGTTTGCCC GGTTGGAACAAATGTCTCAGAAATTTGCAC GGTTGGAGCAGATGTCACAAAAATTCTCAC	4773	7	0.9264705882352942	ACTCACTTCCACCAGATCCAAAACACTTTG ACTCCTTACCACCAGACCCCAAACACTTTG ATTCACTACCACCAGATCCCAAACACTTTG ATTCACTACCACCTGACCCAAAACATTTTG ATTCACTCCCACCAGACCCAAAACATTTTG ATTCCCTCCCACCTGATCCTAAACACTTTG ATTCTCTACCACCTGATCCAAAACATTTTG	8	0.9264705882352942	AAAAGAATCAAAGACCTCAAAAACAAAA ACTTTATACAATTTAGATCAAAACACCG ATGCAGTTTAGAAACAAACAAAGGACTG CAAACAAAGAACTGAACCAGTATGTGTT CAAAGAACCGAACCAGTCTGTGTTCTAA CAGAGAACTTAAAAACAAAATGACAAAT CGCCTTAGAGGCAAAAAGAATTAAATCA TACATACAGTTCAAATCAAAACAAAGAA	{4604} {4638} {4643} {4657} {4661} {4612} {4591} {4640}
10.45672964284277	6793	7041	248	6793	6	0.9117647058823529	AGTGGGATGTGATCCAGATACATTTTGGTC AGTGGGATGTGATCCAGATGTGTTCTGGTC AGTTGGGTGTGATCCAGACACTTTTTGGTC TGTAGGATGTGATCCTGATACCTTCTGGTC TGTGGGATGTGACCCAGATACATTCTGGTC TGTGGGCTGTGACCCCGATGTTTTCTGGTC	7011	6	0.9117647058823529	AAGGAGGAATGCCCTCTGGGTGCTCTGGAA AAGGGGGAATGCCATCAGGTTGCTCAGGTA AAGGTGGAATGCCTTCTGGTTGTTCTGGGA AGGGAGGAATGCCATCAGGTTGTTCAGGCA AGGGAGGGATGCCATCTGGTTGCTCTGGCA AGGGTGGAATGCCATCAGGGTGTTCAGGAA	7	0.9558823529411765	ACTACTCAAATTTTGATGCTTCCCTATC ATACCATGCTTGATGGAAGGACACTTAA GATTATTCAAACTTTGATGCAAGCTTAT TAGTTGCTTTTGATTATTCAAATTTTGA TGGCGTTTGATTACTCAAACTTCGACGC TTTGAATGTTTAGAGAAAGTCTTAAATA TTTGATTATTCAAACTTTGATGCTAGTT	{6864} {6827} {6863} {6852} {6855} {6902} {6860}
